{
  "schema_version": 1,
  "platform": {
    "id": "demo-platform",
    "name": "Public Demo Platform",
    "base_url_env": "DEMO_PLATFORM_BASE_URL",
    "health_path": "/health",
    "write_gate_env": "ALLOW_TEST_WRITES",
    "test_data_prefix": "SOAK_",
    "require_cleanup": true,
    "production": false
  },
  "capabilities": [
    "health",
    "items",
    "devices",
    "browser"
  ],
  "scenarios": [
    {
      "id": "health",
      "title": "Health check",
      "mode": "readonly",
      "capabilities": [
        "health"
      ]
    },
    {
      "id": "list-items",
      "title": "List items",
      "mode": "readonly",
      "capabilities": [
        "items"
      ]
    },
    {
      "id": "create-delete-item",
      "title": "Create and delete isolated item",
      "mode": "write",
      "capabilities": [
        "items"
      ],
      "cleanup": "delete-created"
    },
    {
      "id": "register-device-semantic",
      "title": "Detect invalid device platform semantics",
      "mode": "write",
      "capabilities": [
        "devices"
      ],
      "cleanup": "delete-created"
    },
    {
      "id": "browser-home",
      "title": "Open the demo home page",
      "mode": "readonly",
      "capabilities": [
        "browser"
      ]
    }
  ],
  "adapter": "./examples/demo-platform/adapter.js"
}
